{
  "formatVersion": 2,
  "id": "memphis-93",
  "name": "Memphis \u201993",
  "author": "Amberfader",
  "description": "Radical 90s screen print: squiggles, checkerboards, turquoise, pink, and sunshine yellow.",
  "background": "background.png",
  "palette": {
    "window": "#f6eed9",
    "panel": "#fff8e7",
    "display": "#fff8e7",
    "text": "#15151f",
    "muted": "#41414c",
    "readout": "#15151f",
    "accent": "#007e80",
    "border": "#15151f",
    "buttonTop": "#fff8e7",
    "buttonBottom": "#dfd6c2",
    "danger": "#ad234a"
  },
  "size": [560, 344],
  "drag": [33, 13, 359, 26],
  "font": "sans",
  "timeSize": 30,
  "radius": 0,
  "readoutStyles": {
    "playback": {
      "align": "right"
    },
    "title": {
      "size": 15,
      "bold": true
    },
    "artists": {
      "size": 13
    }
  },
  "sliderStyle": "inset",
  "controls": {
    "art": [38, 54, 114, 114],
    "title": [183, 55, 302, 28],
    "artists": [183, 95, 302, 22],
    "time": [181, 130, 222, 37],
    "playback": [413, 145, 72, 20],
    "previous": [32, 186, 68, 36],
    "play": [108, 182, 82, 44],
    "next": [198, 186, 68, 36],
    "like": [274, 186, 68, 36],
    "volume": [357, 192, 137, 24],
    "seek": [39, 238, 455, 18],
    "search": [32, 269, 151, 28],
    "show": [191, 269, 151, 28],
    "hide": [350, 269, 151, 28],
    "menu": [401, 12, 28, 29],
    "minimize": [437, 12, 28, 29],
    "close": [473, 12, 28, 29],
    "status": [43, 309, 447, 18]
  },
  "buttons": {
    "previous": {
      "normal": "transport-normal.png",
      "hover": "transport-hover.png",
      "pressed": "transport-pressed.png",
      "disabled": "transport-disabled.png"
    },
    "next": {
      "normal": "transport-normal.png",
      "hover": "transport-hover.png",
      "pressed": "transport-pressed.png",
      "disabled": "transport-disabled.png"
    },
    "like": {
      "normal": "transport-normal.png",
      "hover": "transport-hover.png",
      "pressed": "transport-pressed.png",
      "disabled": "transport-disabled.png"
    },
    "play": {
      "normal": "play-normal.png",
      "hover": "play-hover.png",
      "pressed": "play-pressed.png",
      "disabled": "play-disabled.png"
    },
    "search": {
      "normal": "utility-normal.png",
      "hover": "utility-hover.png",
      "pressed": "utility-pressed.png",
      "disabled": "utility-disabled.png"
    },
    "show": {
      "normal": "utility-normal.png",
      "hover": "utility-hover.png",
      "pressed": "utility-pressed.png",
      "disabled": "utility-disabled.png"
    },
    "hide": {
      "normal": "utility-normal.png",
      "hover": "utility-hover.png",
      "pressed": "utility-pressed.png",
      "disabled": "utility-disabled.png"
    },
    "menu": {
      "normal": "chrome-normal.png",
      "hover": "chrome-hover.png",
      "pressed": "chrome-pressed.png",
      "disabled": "chrome-disabled.png"
    },
    "minimize": {
      "normal": "chrome-normal.png",
      "hover": "chrome-hover.png",
      "pressed": "chrome-pressed.png",
      "disabled": "chrome-disabled.png"
    },
    "close": {
      "normal": "chrome-normal.png",
      "hover": "chrome-hover.png",
      "pressed": "chrome-pressed.png",
      "disabled": "chrome-disabled.png"
    }
  }
}
