{
  "formatVersion": 1,
  "id": "rave-grid",
  "name": "Rave Grid",
  "author": "Amberfader",
  "description": "Underground 1995 club graphics: acid lime, ultraviolet, halftones, and laser cyan.",
  "background": "background.png",
  "palette": {
    "window": "#101115",
    "panel": "#21232b",
    "display": "#080e10",
    "text": "#edffd3",
    "muted": "#bdd49b",
    "readout": "#d9ff72",
    "accent": "#c9f53b",
    "border": "#687d42",
    "buttonTop": "#343b27",
    "buttonBottom": "#191e12",
    "danger": "#ff9ec0"
  },
  "size": [560, 344],
  "drag": [28, 18, 378, 28],
  "font": "mono",
  "timeSize": 30,
  "radius": 0,
  "controls": {
    "art": [28, 64, 120, 120],
    "title": [180, 66, 338, 26],
    "artists": [180, 98, 338, 22],
    "time": [180, 128, 224, 44],
    "playback": [414, 146, 104, 20],
    "previous": [28, 198, 48, 36],
    "play": [84, 192, 60, 48],
    "next": [152, 198, 48, 36],
    "like": [212, 198, 48, 36],
    "volume": [378, 204, 140, 22],
    "seek": [28, 244, 490, 20],
    "search": [28, 278, 86, 28],
    "show": [124, 278, 100, 28],
    "hide": [234, 278, 74, 28],
    "menu": [424, 18, 34, 28],
    "minimize": [466, 18, 24, 28],
    "close": [498, 18, 24, 28],
    "status": [28, 314, 490, 18]
  },
  "buttons": {
    "previous": {
      "normal": "transport-normal.png",
      "hover": "transport-hover.png",
      "pressed": "transport-pressed.png",
      "disabled": "transport-disabled.png"
    },
    "next": {
      "normal": "transport-normal.png",
      "hover": "transport-hover.png",
      "pressed": "transport-pressed.png",
      "disabled": "transport-disabled.png"
    },
    "like": {
      "normal": "transport-normal.png",
      "hover": "transport-hover.png",
      "pressed": "transport-pressed.png",
      "disabled": "transport-disabled.png"
    },
    "play": {
      "normal": "play-normal.png",
      "hover": "play-hover.png",
      "pressed": "play-pressed.png",
      "disabled": "play-disabled.png"
    },
    "search": {
      "normal": "utility-normal.png",
      "hover": "utility-hover.png",
      "pressed": "utility-pressed.png",
      "disabled": "utility-disabled.png"
    },
    "show": {
      "normal": "utility-normal.png",
      "hover": "utility-hover.png",
      "pressed": "utility-pressed.png",
      "disabled": "utility-disabled.png"
    },
    "hide": {
      "normal": "utility-normal.png",
      "hover": "utility-hover.png",
      "pressed": "utility-pressed.png",
      "disabled": "utility-disabled.png"
    },
    "menu": {
      "normal": "chrome-normal.png",
      "hover": "chrome-hover.png",
      "pressed": "chrome-pressed.png",
      "disabled": "chrome-disabled.png"
    },
    "minimize": {
      "normal": "chrome-normal.png",
      "hover": "chrome-hover.png",
      "pressed": "chrome-pressed.png",
      "disabled": "chrome-disabled.png"
    },
    "close": {
      "normal": "chrome-normal.png",
      "hover": "chrome-hover.png",
      "pressed": "chrome-pressed.png",
      "disabled": "chrome-disabled.png"
    }
  }
}
