{
  "formatVersion": 2,
  "id": "aureole",
  "name": "Aureole",
  "author": "Amberfader",
  "description": "A gold oval lens held by an asymmetrical silver and navy crescent, with a left transport pod.",
  "background": "background.png",
  "font": "sans",
  "size": [600, 400],
  "drag": [278, 53, 128, 18],
  "timeSize": 26,
  "radius": 10,
  "palette": {
    "window": "#e1ded3",
    "panel": "#c2c7ca",
    "display": "#f0ca60",
    "text": "#25303d",
    "muted": "#372a0b",
    "readout": "#2c2106",
    "accent": "#98672b",
    "border": "#697578",
    "buttonTop": "#f0f3f4",
    "buttonBottom": "#aeb7bf",
    "danger": "#782510"
  },
  "coverGlass": true,
  "sliderStyle": "inset",
  "readoutStyles": {
    "title": {"align": "center", "font": "mono", "size": 12, "bold": true},
    "artists": {"align": "center", "font": "mono", "size": 11, "bold": false},
    "time": {"align": "center", "font": "mono", "size": 24, "bold": false},
    "playback": {"align": "center", "font": "mono", "size": 10, "bold": false},
    "status": {"align": "center", "font": "mono", "size": 10, "bold": false}
  },
  "controlShapes": {
    "art": "ellipse",
    "previous": "ellipse",
    "play": "ellipse",
    "next": "ellipse",
    "like": "ellipse",
    "search": "capsule",
    "show": "capsule",
    "hide": "capsule",
    "menu": "ellipse",
    "minimize": "ellipse",
    "close": "ellipse"
  },
  "controls": {
    "art": [30, 143, 80, 80],
    "title": [232, 96, 248, 20],
    "artists": [208, 122, 296, 18],
    "time": [218, 144, 276, 30],
    "playback": [270, 178, 172, 18],
    "status": [220, 198, 272, 18],
    "seek": [231, 219, 250, 18],
    "volume": [298, 240, 116, 18],
    "previous": [145, 267, 28, 28],
    "play": [181, 257, 38, 38],
    "next": [228, 263, 28, 28],
    "like": [265, 265, 36, 28],
    "search": [320, 275, 60, 22],
    "show": [391, 278, 68, 22],
    "hide": [470, 266, 50, 22],
    "menu": [57, 104, 22, 22],
    "minimize": [79, 105, 22, 22],
    "close": [101, 109, 22, 22]
  },
  "buttons": {
    "previous": {
      "normal": "transport-normal.png",
      "hover": "transport-hover.png",
      "pressed": "transport-pressed.png",
      "disabled": "transport-disabled.png"
    },
    "next": {
      "normal": "transport-normal.png",
      "hover": "transport-hover.png",
      "pressed": "transport-pressed.png",
      "disabled": "transport-disabled.png"
    },
    "like": {
      "normal": "transport-normal.png",
      "hover": "transport-hover.png",
      "pressed": "transport-pressed.png",
      "disabled": "transport-disabled.png"
    },
    "play": {
      "normal": "play-normal.png",
      "hover": "play-hover.png",
      "pressed": "play-pressed.png",
      "disabled": "play-disabled.png"
    },
    "search": {
      "normal": "utility-normal.png",
      "hover": "utility-hover.png",
      "pressed": "utility-pressed.png",
      "disabled": "utility-disabled.png"
    },
    "show": {
      "normal": "utility-normal.png",
      "hover": "utility-hover.png",
      "pressed": "utility-pressed.png",
      "disabled": "utility-disabled.png"
    },
    "hide": {
      "normal": "utility-normal.png",
      "hover": "utility-hover.png",
      "pressed": "utility-pressed.png",
      "disabled": "utility-disabled.png"
    },
    "menu": {
      "normal": "chrome-normal.png",
      "hover": "chrome-hover.png",
      "pressed": "chrome-pressed.png",
      "disabled": "chrome-disabled.png"
    },
    "minimize": {
      "normal": "chrome-normal.png",
      "hover": "chrome-hover.png",
      "pressed": "chrome-pressed.png",
      "disabled": "chrome-disabled.png"
    },
    "close": {
      "normal": "chrome-normal.png",
      "hover": "chrome-hover.png",
      "pressed": "chrome-pressed.png",
      "disabled": "chrome-disabled.png"
    }
  }
}
