{
  "formatVersion": 2,
  "id": "viridian",
  "name": "Viridian",
  "author": "Amberfader",
  "description": "A luminous green circular lens wrapped by an open brushed-silver crescent and rim controls.",
  "background": "background.png",
  "font": "sans",
  "size": [440, 440],
  "drag": [175, 98, 144, 24],
  "timeSize": 26,
  "radius": 10,
  "palette": {
    "window": "#dfe5df",
    "panel": "#bdcbc2",
    "display": "#84e88b",
    "text": "#173028",
    "muted": "#1a3a24",
    "readout": "#103a1b",
    "accent": "#238740",
    "border": "#667c71",
    "buttonTop": "#f2f6f1",
    "buttonBottom": "#abbfb0",
    "danger": "#7d201d"
  },
  "coverGlass": true,
  "sliderStyle": "inset",
  "readoutStyles": {
    "title": {"align": "center", "font": "mono", "size": 12, "bold": true},
    "artists": {"align": "center", "font": "mono", "size": 11, "bold": false},
    "time": {"align": "center", "font": "mono", "size": 24, "bold": false},
    "playback": {"align": "center", "font": "mono", "size": 10, "bold": false},
    "status": {"align": "center", "font": "mono", "size": 10, "bold": false}
  },
  "controlShapes": {
    "art": "ellipse",
    "previous": "ellipse",
    "play": "ellipse",
    "next": "ellipse",
    "like": "ellipse",
    "search": "ellipse",
    "show": "ellipse",
    "hide": "ellipse",
    "menu": "ellipse",
    "minimize": "ellipse",
    "close": "ellipse"
  },
  "controls": {
    "art": [35, 193, 52, 54],
    "title": [152, 126, 190, 20],
    "artists": [135, 149, 224, 18],
    "time": [134, 170, 226, 34],
    "playback": [173, 206, 148, 18],
    "status": [119, 227, 256, 18],
    "seek": [134, 253, 226, 18],
    "volume": [167, 280, 160, 18],
    "previous": [62, 271, 30, 30],
    "play": [104, 324, 38, 38],
    "next": [153, 355, 30, 30],
    "like": [307, 349, 30, 30],
    "search": [199, 373, 70, 22],
    "show": [140, 48, 71, 24],
    "hide": [217, 42, 70, 22],
    "menu": [114, 75, 24, 24],
    "minimize": [84, 104, 24, 24],
    "close": [62, 139, 24, 24]
  },
  "buttons": {
    "previous": {
      "normal": "transport-normal.png",
      "hover": "transport-hover.png",
      "pressed": "transport-pressed.png",
      "disabled": "transport-disabled.png"
    },
    "next": {
      "normal": "transport-normal.png",
      "hover": "transport-hover.png",
      "pressed": "transport-pressed.png",
      "disabled": "transport-disabled.png"
    },
    "like": {
      "normal": "transport-normal.png",
      "hover": "transport-hover.png",
      "pressed": "transport-pressed.png",
      "disabled": "transport-disabled.png"
    },
    "play": {
      "normal": "play-normal.png",
      "hover": "play-hover.png",
      "pressed": "play-pressed.png",
      "disabled": "play-disabled.png"
    },
    "search": {
      "normal": "utility-normal.png",
      "hover": "utility-hover.png",
      "pressed": "utility-pressed.png",
      "disabled": "utility-disabled.png"
    },
    "show": {
      "normal": "utility-normal.png",
      "hover": "utility-hover.png",
      "pressed": "utility-pressed.png",
      "disabled": "utility-disabled.png"
    },
    "hide": {
      "normal": "utility-normal.png",
      "hover": "utility-hover.png",
      "pressed": "utility-pressed.png",
      "disabled": "utility-disabled.png"
    },
    "menu": {
      "normal": "chrome-normal.png",
      "hover": "chrome-hover.png",
      "pressed": "chrome-pressed.png",
      "disabled": "chrome-disabled.png"
    },
    "minimize": {
      "normal": "chrome-normal.png",
      "hover": "chrome-hover.png",
      "pressed": "chrome-pressed.png",
      "disabled": "chrome-disabled.png"
    },
    "close": {
      "normal": "chrome-normal.png",
      "hover": "chrome-hover.png",
      "pressed": "chrome-pressed.png",
      "disabled": "chrome-disabled.png"
    }
  },
  "controlRotations": {
    "show": -16.9,
    "hide": 8.5
  }
}
