{
  "formatVersion": 2,
  "id": "paper-signal",
  "name": "Paper Signal",
  "author": "Amberfader",
  "description": "A classic-Mac cover sleeve: pinstripe title bar, cream paper, and clicky ink-stamped controls.",
  "size": [500, 392],
  "background": "background.png",
  "drag": [31, 15, 329, 26],
  "font": "sans",
  "timeSize": 30,
  "radius": 0,
  "palette": {
    "window": "#eee5cf",
    "panel": "#fff9e9",
    "display": "#ddd1b8",
    "text": "#302e2b",
    "muted": "#5e574b",
    "readout": "#302e2b",
    "accent": "#416556",
    "border": "#8d8576",
    "buttonTop": "#fffcef",
    "buttonBottom": "#ded4bf",
    "danger": "#a52f29"
  },
  "readoutStyles": {
    "title": {"size": 15, "bold": true},
    "artists": {"size": 13}
  },
  "controls": {
    "art": [36, 58, 155, 155],
    "title": [222, 59, 231, 28],
    "artists": [222, 101, 231, 22],
    "time": [220, 138, 233, 37],
    "playback": [222, 188, 231, 24],
    "previous": [30, 231, 62, 36],
    "play": [100, 227, 80, 44],
    "next": [188, 231, 62, 36],
    "like": [258, 231, 62, 36],
    "volume": [335, 237, 127, 24],
    "seek": [37, 283, 425, 18],
    "search": [30, 314, 141, 28],
    "show": [179, 314, 141, 28],
    "hide": [328, 314, 141, 28],
    "menu": [369, 14, 28, 29],
    "minimize": [405, 14, 28, 29],
    "close": [441, 14, 28, 29],
    "status": [30, 348, 422, 18]
  },
  "buttons": {
    "previous": {
      "normal": "transport-normal.png",
      "hover": "transport-hover.png",
      "pressed": "transport-pressed.png",
      "disabled": "transport-disabled.png"
    },
    "next": {
      "normal": "transport-normal.png",
      "hover": "transport-hover.png",
      "pressed": "transport-pressed.png",
      "disabled": "transport-disabled.png"
    },
    "like": {
      "normal": "transport-normal.png",
      "hover": "transport-hover.png",
      "pressed": "transport-pressed.png",
      "disabled": "transport-disabled.png"
    },
    "play": {
      "normal": "play-normal.png",
      "hover": "play-hover.png",
      "pressed": "play-pressed.png",
      "disabled": "play-disabled.png"
    },
    "search": {
      "normal": "utility-normal.png",
      "hover": "utility-hover.png",
      "pressed": "utility-pressed.png",
      "disabled": "utility-disabled.png"
    },
    "show": {
      "normal": "utility-normal.png",
      "hover": "utility-hover.png",
      "pressed": "utility-pressed.png",
      "disabled": "utility-disabled.png"
    },
    "hide": {
      "normal": "utility-normal.png",
      "hover": "utility-hover.png",
      "pressed": "utility-pressed.png",
      "disabled": "utility-disabled.png"
    },
    "menu": {
      "normal": "chrome-normal.png",
      "hover": "chrome-hover.png",
      "pressed": "chrome-pressed.png",
      "disabled": "chrome-disabled.png"
    },
    "minimize": {
      "normal": "chrome-normal.png",
      "hover": "chrome-hover.png",
      "pressed": "chrome-pressed.png",
      "disabled": "chrome-disabled.png"
    },
    "close": {
      "normal": "chrome-normal.png",
      "hover": "chrome-hover.png",
      "pressed": "chrome-pressed.png",
      "disabled": "chrome-disabled.png"
    }
  }
}
