{
  "formatVersion": 2,
  "id": "manta-ray",
  "name": "Manta Ray",
  "author": "Amberfader",
  "description": "A flowing silver and teal biomorphic remote with sweeping fins, an open tail curl, and inset glass.",
  "background": "background.png",
  "font": "sans",
  "size": [840, 560],
  "drag": [200, 122, 80, 18],
  "timeSize": 20,
  "radius": 20,
  "palette": {
    "window": "#123642",
    "panel": "#174250",
    "display": "#0a263e",
    "text": "#ecfbff",
    "muted": "#b6d9dd",
    "readout": "#d7fbff",
    "accent": "#54e5dd",
    "border": "#6ea8af",
    "buttonTop": "#3b7681",
    "buttonBottom": "#153849",
    "danger": "#ffceba"
  },
  "coverGlass": true,
  "sliderStyle": "inset",
  "readoutStyles": {
    "title": {"size": 14},
    "playback": {"size": 11},
    "status": {"size": 10}
  },
  "controlShapes": {
    "art": "ellipse",
    "previous": "ellipse",
    "play": "ellipse",
    "next": "ellipse",
    "like": "ellipse",
    "search": "capsule",
    "show": "capsule",
    "hide": "capsule",
    "menu": "ellipse",
    "minimize": "ellipse",
    "close": "ellipse"
  },
  "controls": {
    "art": [129, 157, 124, 124],
    "title": [296, 198, 150, 18],
    "artists": [296, 216, 150, 18],
    "time": [296, 236, 148, 22],
    "playback": [466, 198, 80, 18],
    "seek": [466, 238, 116, 18],
    "previous": [253, 293, 36, 36],
    "play": [580, 115, 70, 70],
    "next": [311, 309, 36, 36],
    "like": [522, 135, 36, 36],
    "volume": [466, 216, 104, 18],
    "search": [333, 259, 64, 22],
    "show": [402, 259, 64, 22],
    "hide": [471, 259, 64, 22],
    "menu": [539, 299, 28, 28],
    "minimize": [583, 291, 28, 28],
    "close": [627, 288, 28, 28],
    "status": [378, 322, 112, 19]
  },
  "buttons": {
    "previous": {
      "normal": "transport-normal.png",
      "hover": "transport-hover.png",
      "pressed": "transport-pressed.png",
      "disabled": "transport-disabled.png"
    },
    "next": {
      "normal": "transport-normal.png",
      "hover": "transport-hover.png",
      "pressed": "transport-pressed.png",
      "disabled": "transport-disabled.png"
    },
    "like": {
      "normal": "transport-normal.png",
      "hover": "transport-hover.png",
      "pressed": "transport-pressed.png",
      "disabled": "transport-disabled.png"
    },
    "play": {
      "normal": "play-normal.png",
      "hover": "play-hover.png",
      "pressed": "play-pressed.png",
      "disabled": "play-disabled.png"
    },
    "search": {
      "normal": "utility-normal.png",
      "hover": "utility-hover.png",
      "pressed": "utility-pressed.png",
      "disabled": "utility-disabled.png"
    },
    "show": {
      "normal": "utility-normal.png",
      "hover": "utility-hover.png",
      "pressed": "utility-pressed.png",
      "disabled": "utility-disabled.png"
    },
    "hide": {
      "normal": "utility-normal.png",
      "hover": "utility-hover.png",
      "pressed": "utility-pressed.png",
      "disabled": "utility-disabled.png"
    },
    "menu": {
      "normal": "chrome-normal.png",
      "hover": "chrome-hover.png",
      "pressed": "chrome-pressed.png",
      "disabled": "chrome-disabled.png"
    },
    "minimize": {
      "normal": "chrome-normal.png",
      "hover": "chrome-hover.png",
      "pressed": "chrome-pressed.png",
      "disabled": "chrome-disabled.png"
    },
    "close": {
      "normal": "chrome-normal.png",
      "hover": "chrome-hover.png",
      "pressed": "chrome-pressed.png",
      "disabled": "chrome-disabled.png"
    }
  }
}
