{
  "formatVersion": 2,
  "id": "keystone",
  "name": "Keystone",
  "author": "Amberfader",
  "description": "A clipped and stepped steel badge with a warm amber readout and two precise control rows.",
  "background": "background.png",
  "font": "sans",
  "size": [540, 360],
  "drag": [100, 36, 340, 18],
  "timeSize": 26,
  "radius": 6,
  "palette": {
    "window": "#25282a",
    "panel": "#323639",
    "display": "#151c21",
    "text": "#f6ead9",
    "muted": "#c2b49a",
    "readout": "#ffdc91",
    "accent": "#ffb347",
    "border": "#8b8273",
    "buttonTop": "#656664",
    "buttonBottom": "#262b2e",
    "danger": "#ffbba5"
  },
  "coverGlass": true,
  "sliderStyle": "inset",
  "readoutStyles": {
    "title": {"align": "left", "font": "mono"},
    "artists": {"align": "left", "font": "mono"},
    "time": {"align": "left", "font": "mono"},
    "playback": {"align": "right", "font": "mono", "size": 11},
    "status": {"align": "left", "font": "mono", "size": 11}
  },
  "controlShapes": {
    "art": "ellipse",
    "previous": "ellipse",
    "play": "ellipse",
    "next": "ellipse",
    "like": "ellipse",
    "search": "capsule",
    "show": "capsule",
    "hide": "capsule",
    "menu": "ellipse",
    "minimize": "ellipse",
    "close": "ellipse"
  },
  "controls": {
    "art": [54, 87, 97, 97],
    "title": [189, 71, 263, 20],
    "artists": [189, 93, 297, 18],
    "time": [188, 113, 212, 30],
    "playback": [406, 117, 80, 20],
    "status": [189, 145, 297, 18],
    "seek": [189, 167, 297, 18],
    "previous": [40, 232, 40, 28],
    "play": [88, 228, 48, 36],
    "next": [144, 232, 40, 28],
    "like": [192, 232, 40, 28],
    "volume": [252, 237, 144, 18],
    "search": [160, 266, 68, 24],
    "show": [236, 266, 68, 24],
    "hide": [312, 266, 68, 24],
    "menu": [416, 234, 24, 24],
    "minimize": [446, 234, 24, 24],
    "close": [476, 234, 24, 24]
  },
  "buttons": {
    "previous": {
      "normal": "transport-normal.png",
      "hover": "transport-hover.png",
      "pressed": "transport-pressed.png",
      "disabled": "transport-disabled.png"
    },
    "next": {
      "normal": "transport-normal.png",
      "hover": "transport-hover.png",
      "pressed": "transport-pressed.png",
      "disabled": "transport-disabled.png"
    },
    "like": {
      "normal": "transport-normal.png",
      "hover": "transport-hover.png",
      "pressed": "transport-pressed.png",
      "disabled": "transport-disabled.png"
    },
    "play": {
      "normal": "play-normal.png",
      "hover": "play-hover.png",
      "pressed": "play-pressed.png",
      "disabled": "play-disabled.png"
    },
    "search": {
      "normal": "utility-normal.png",
      "hover": "utility-hover.png",
      "pressed": "utility-pressed.png",
      "disabled": "utility-disabled.png"
    },
    "show": {
      "normal": "utility-normal.png",
      "hover": "utility-hover.png",
      "pressed": "utility-pressed.png",
      "disabled": "utility-disabled.png"
    },
    "hide": {
      "normal": "utility-normal.png",
      "hover": "utility-hover.png",
      "pressed": "utility-pressed.png",
      "disabled": "utility-disabled.png"
    },
    "menu": {
      "normal": "chrome-normal.png",
      "hover": "chrome-hover.png",
      "pressed": "chrome-pressed.png",
      "disabled": "chrome-disabled.png"
    },
    "minimize": {
      "normal": "chrome-normal.png",
      "hover": "chrome-hover.png",
      "pressed": "chrome-pressed.png",
      "disabled": "chrome-disabled.png"
    },
    "close": {
      "normal": "chrome-normal.png",
      "hover": "chrome-hover.png",
      "pressed": "chrome-pressed.png",
      "disabled": "chrome-disabled.png"
    }
  }
}
