{
  "formatVersion": 2,
  "id": "tangent",
  "name": "Tangent",
  "author": "Amberfader",
  "description": "A satin-silver crescent around navy glass, with a slim open rail and compact transport shelf.",
  "background": "background.png",
  "font": "sans",
  "size": [640, 320],
  "drag": [70, 54, 100, 20],
  "timeSize": 26,
  "radius": 6,
  "palette": {
    "window": "#1b3043",
    "panel": "#223a4d",
    "display": "#06182e",
    "text": "#edf6ff",
    "muted": "#aac7d9",
    "readout": "#d9f0ff",
    "accent": "#36d7f0",
    "border": "#718e9f",
    "buttonTop": "#415a6c",
    "buttonBottom": "#1b2b39",
    "danger": "#ffb59a"
  },
  "coverGlass": true,
  "sliderStyle": "inset",
  "readoutStyles": {
    "title": {"size": 14},
    "playback": {"align": "right", "size": 11},
    "status": {"size": 11}
  },
  "controlShapes": {
    "art": "ellipse",
    "previous": "ellipse",
    "play": "ellipse",
    "next": "ellipse",
    "like": "ellipse",
    "search": "capsule",
    "show": "capsule",
    "hide": "capsule",
    "menu": "ellipse",
    "minimize": "ellipse",
    "close": "ellipse"
  },
  "controls": {
    "art": [56, 82, 132, 128],
    "title": [238, 91, 319, 18],
    "artists": [238, 111, 319, 18],
    "time": [238, 131, 233, 28],
    "playback": [477, 141, 80, 18],
    "status": [238, 160, 319, 18],
    "seek": [238, 186, 319, 18],
    "previous": [104, 224, 40, 26],
    "play": [148, 220, 42, 34],
    "next": [194, 224, 40, 26],
    "like": [238, 224, 40, 26],
    "volume": [283, 228, 80, 18],
    "search": [368, 224, 59, 26],
    "show": [431, 224, 71, 26],
    "hide": [506, 224, 44, 26],
    "menu": [581, 95, 24, 24],
    "minimize": [581, 127, 24, 24],
    "close": [581, 159, 24, 24]
  },
  "buttons": {
    "previous": {
      "normal": "transport-normal.png",
      "hover": "transport-hover.png",
      "pressed": "transport-pressed.png",
      "disabled": "transport-disabled.png"
    },
    "next": {
      "normal": "transport-normal.png",
      "hover": "transport-hover.png",
      "pressed": "transport-pressed.png",
      "disabled": "transport-disabled.png"
    },
    "like": {
      "normal": "transport-normal.png",
      "hover": "transport-hover.png",
      "pressed": "transport-pressed.png",
      "disabled": "transport-disabled.png"
    },
    "play": {
      "normal": "play-normal.png",
      "hover": "play-hover.png",
      "pressed": "play-pressed.png",
      "disabled": "play-disabled.png"
    },
    "search": {
      "normal": "search-normal.png",
      "hover": "search-hover.png",
      "pressed": "search-pressed.png",
      "disabled": "search-disabled.png"
    },
    "show": {
      "normal": "utility-normal.png",
      "hover": "utility-hover.png",
      "pressed": "utility-pressed.png",
      "disabled": "utility-disabled.png"
    },
    "hide": {
      "normal": "hide-normal.png",
      "hover": "hide-hover.png",
      "pressed": "hide-pressed.png",
      "disabled": "hide-disabled.png"
    },
    "menu": {
      "normal": "chrome-normal.png",
      "hover": "chrome-hover.png",
      "pressed": "chrome-pressed.png",
      "disabled": "chrome-disabled.png"
    },
    "minimize": {
      "normal": "chrome-normal.png",
      "hover": "chrome-hover.png",
      "pressed": "chrome-pressed.png",
      "disabled": "chrome-disabled.png"
    },
    "close": {
      "normal": "chrome-normal.png",
      "hover": "chrome-hover.png",
      "pressed": "chrome-pressed.png",
      "disabled": "chrome-disabled.png"
    }
  }
}
