{
  "formatVersion": 1,
  "id": "amber-classic",
  "name": "Amber Classic",
  "author": "Amberfader",
  "description": "An amber hi-fi remote: warm glass, dark walnut, and a compact cover display.",
  "size": [560, 344],
  "background": "background.png",
  "drag": [28, 18, 378, 28],
  "font": "sans",
  "timeSize": 30,
  "radius": 7,
  "palette": {
    "window": "#20150f",
    "panel": "#352316",
    "display": "#140f09",
    "text": "#fff1d2",
    "muted": "#e2c6a2",
    "readout": "#ffd184",
    "accent": "#e8a33d",
    "border": "#a07b46",
    "buttonTop": "#755635",
    "buttonBottom": "#352316",
    "danger": "#ff8b79"
  },
  "controls": {
    "art": [28, 64, 120, 120],
    "title": [180, 66, 338, 26],
    "artists": [180, 98, 338, 22],
    "time": [180, 128, 224, 44],
    "playback": [414, 146, 104, 20],
    "previous": [28, 198, 48, 36],
    "play": [84, 192, 60, 48],
    "next": [152, 198, 48, 36],
    "like": [212, 198, 48, 36],
    "volume": [378, 204, 140, 22],
    "seek": [28, 244, 490, 20],
    "search": [28, 278, 86, 28],
    "show": [124, 278, 100, 28],
    "hide": [234, 278, 74, 28],
    "menu": [424, 18, 34, 28],
    "minimize": [466, 18, 24, 28],
    "close": [498, 18, 24, 28],
    "status": [28, 314, 490, 18]
  },
  "buttons": {
    "previous": {
      "normal": "transport-normal.png",
      "hover": "transport-hover.png",
      "pressed": "transport-pressed.png",
      "disabled": "transport-disabled.png"
    },
    "next": {
      "normal": "transport-normal.png",
      "hover": "transport-hover.png",
      "pressed": "transport-pressed.png",
      "disabled": "transport-disabled.png"
    },
    "like": {
      "normal": "transport-normal.png",
      "hover": "transport-hover.png",
      "pressed": "transport-pressed.png",
      "disabled": "transport-disabled.png"
    },
    "play": {
      "normal": "play-normal.png",
      "hover": "play-hover.png",
      "pressed": "play-pressed.png",
      "disabled": "play-disabled.png"
    },
    "search": {
      "normal": "utility-normal.png",
      "hover": "utility-hover.png",
      "pressed": "utility-pressed.png",
      "disabled": "utility-disabled.png"
    },
    "show": {
      "normal": "utility-normal.png",
      "hover": "utility-hover.png",
      "pressed": "utility-pressed.png",
      "disabled": "utility-disabled.png"
    },
    "hide": {
      "normal": "utility-normal.png",
      "hover": "utility-hover.png",
      "pressed": "utility-pressed.png",
      "disabled": "utility-disabled.png"
    },
    "menu": {
      "normal": "chrome-normal.png",
      "hover": "chrome-hover.png",
      "pressed": "chrome-pressed.png",
      "disabled": "chrome-disabled.png"
    },
    "minimize": {
      "normal": "chrome-normal.png",
      "hover": "chrome-hover.png",
      "pressed": "chrome-pressed.png",
      "disabled": "chrome-disabled.png"
    },
    "close": {
      "normal": "chrome-normal.png",
      "hover": "chrome-hover.png",
      "pressed": "chrome-pressed.png",
      "disabled": "chrome-disabled.png"
    }
  }
}
