{
  "formatVersion": 2,
  "id": "copper-reel",
  "name": "Copper Reel",
  "author": "Amberfader",
  "description": "Brushed copper and amber glass with a complete circular platter and warm machined controls.",
  "size": [640, 344],
  "background": "background.png",
  "drag": [37, 18, 269, 26],
  "font": "sans",
  "timeSize": 30,
  "radius": 14,
  "readoutStyles": {
    "title": {
      "size": 15,
      "bold": true
    }
  },
  "palette": {
    "window": "#332018",
    "panel": "#543325",
    "display": "#27190f",
    "text": "#fff0d0",
    "muted": "#ffe0b5",
    "readout": "#ffda90",
    "accent": "#ffc86e",
    "border": "#a87846",
    "buttonTop": "#b27b4e",
    "buttonBottom": "#5c3923",
    "danger": "#ffd0b6"
  },
  "controls": {
    "art": [42, 67, 121, 121],
    "title": [193, 68, 206, 30],
    "artists": [193, 99, 206, 22],
    "time": [192, 125, 207, 35],
    "playback": [193, 162, 206, 25],
    "previous": [455, 152, 40, 36],
    "play": [502, 140, 60, 60],
    "next": [569, 152, 40, 36],
    "like": [512, 206, 40, 36],
    "volume": [488, 104, 88, 24],
    "seek": [43, 215, 365, 18],
    "search": [36, 253, 121, 28],
    "show": [165, 253, 121, 28],
    "hide": [294, 253, 121, 28],
    "menu": [315, 17, 28, 29],
    "minimize": [351, 17, 28, 29],
    "close": [387, 17, 28, 29],
    "status": [47, 301, 544, 18]
  },
  "buttons": {
    "previous": {
      "normal": "transport-normal.png",
      "hover": "transport-hover.png",
      "pressed": "transport-pressed.png",
      "disabled": "transport-disabled.png"
    },
    "next": {
      "normal": "transport-normal.png",
      "hover": "transport-hover.png",
      "pressed": "transport-pressed.png",
      "disabled": "transport-disabled.png"
    },
    "like": {
      "normal": "transport-normal.png",
      "hover": "transport-hover.png",
      "pressed": "transport-pressed.png",
      "disabled": "transport-disabled.png"
    },
    "play": {
      "normal": "play-normal.png",
      "hover": "play-hover.png",
      "pressed": "play-pressed.png",
      "disabled": "play-disabled.png"
    },
    "search": {
      "normal": "utility-normal.png",
      "hover": "utility-hover.png",
      "pressed": "utility-pressed.png",
      "disabled": "utility-disabled.png"
    },
    "show": {
      "normal": "utility-normal.png",
      "hover": "utility-hover.png",
      "pressed": "utility-pressed.png",
      "disabled": "utility-disabled.png"
    },
    "hide": {
      "normal": "utility-normal.png",
      "hover": "utility-hover.png",
      "pressed": "utility-pressed.png",
      "disabled": "utility-disabled.png"
    },
    "menu": {
      "normal": "chrome-normal.png",
      "hover": "chrome-hover.png",
      "pressed": "chrome-pressed.png",
      "disabled": "chrome-disabled.png"
    },
    "minimize": {
      "normal": "chrome-normal.png",
      "hover": "chrome-hover.png",
      "pressed": "chrome-pressed.png",
      "disabled": "chrome-disabled.png"
    },
    "close": {
      "normal": "chrome-normal.png",
      "hover": "chrome-hover.png",
      "pressed": "chrome-pressed.png",
      "disabled": "chrome-disabled.png"
    }
  }
}
